"Problem","Package","File","Priority","Line","Description","Rule set","Rule"
"1","","/Users/martinhoaragao/Dev/ProgrammerProfiler/ExerciseExamples/Ex2_P2_Idades/Aluno22/Ex2.java","3","2","All classes and interfaces must belong to a named package","Code Style","NoPackage"
"2","","/Users/martinhoaragao/Dev/ProgrammerProfiler/ExerciseExamples/Ex2_P2_Idades/Aluno22/Ex2.java","1","2","The utility class name 'Ex2' doesn't match '[A-Z][a-zA-Z0-9]+(Utils?|Helper)'","Code Style","ClassNamingConventions"
"3","","/Users/martinhoaragao/Dev/ProgrammerProfiler/ExerciseExamples/Ex2_P2_Idades/Aluno22/Ex2.java","3","3","All methods are static.  Consider using a utility class instead. Alternatively, you could add a private constructor or make the class abstract to silence this warning.","Design","UseUtilityClass"
"4","","/Users/martinhoaragao/Dev/ProgrammerProfiler/ExerciseExamples/Ex2_P2_Idades/Aluno22/Ex2.java","1","4","The method parameter name 'M' doesn't match '[a-z][a-zA-Z0-9]*'","Code Style","FormalParameterNamingConventions"
"5","","/Users/martinhoaragao/Dev/ProgrammerProfiler/ExerciseExamples/Ex2_P2_Idades/Aluno22/Ex2.java","1","4","The method parameter name 'N' doesn't match '[a-z][a-zA-Z0-9]*'","Code Style","FormalParameterNamingConventions"
"6","","/Users/martinhoaragao/Dev/ProgrammerProfiler/ExerciseExamples/Ex2_P2_Idades/Aluno22/Ex2.java","3","16","This statement should have braces","Code Style","ControlStatementBraces"
