"Problem","Package","File","Priority","Line","Description","Rule set","Rule"
"1","","/Users/martinhoaragao/Dev/ProgrammerProfiler/ExerciseExamples/Ex2_P2_Idades/Aluno6/Ex2.java","4","3","Avoid duplicate imports such as 'java.util.Scanner'","Code Style","DuplicateImports"
"2","","/Users/martinhoaragao/Dev/ProgrammerProfiler/ExerciseExamples/Ex2_P2_Idades/Aluno6/Ex2.java","4","4","Avoid unused imports such as 'java.io'","Best Practices","UnusedImports"
"3","","/Users/martinhoaragao/Dev/ProgrammerProfiler/ExerciseExamples/Ex2_P2_Idades/Aluno6/Ex2.java","4","6","All classes and interfaces must belong to a named package","Code Style","GenericsNaming"
"4","","/Users/martinhoaragao/Dev/ProgrammerProfiler/ExerciseExamples/Ex2_P2_Idades/Aluno6/Ex2.java","3","7","All methods are static.  Consider using a utility class instead. Alternatively, you could add a private constructor or make the class abstract to silence this warning.","Design","UseUtilityClass"
"5","","/Users/martinhoaragao/Dev/ProgrammerProfiler/ExerciseExamples/Ex2_P2_Idades/Aluno6/Ex2.java","4","9","Use one line for each declaration, it enhances code readability.","Code Style","GenericsNaming"
