"Problem","Package","File","Priority","Line","Description","Rule set","Rule"
"1","","/Users/martinhoaragao/Dev/ProgrammerProfiler/ExerciseExamples/Ex3_A1_Arrays/Z/A1_Z.java","4","1","Avoid unused imports such as 'java.io'","Best Practices","UnusedImports"
"2","","/Users/martinhoaragao/Dev/ProgrammerProfiler/ExerciseExamples/Ex3_A1_Arrays/Z/A1_Z.java","3","4","All classes and interfaces must belong to a named package","Code Style","NoPackage"
"3","","/Users/martinhoaragao/Dev/ProgrammerProfiler/ExerciseExamples/Ex3_A1_Arrays/Z/A1_Z.java","3","4","All methods are static.  Consider using a utility class instead. Alternatively, you could add a private constructor or make the class abstract to silence this warning.","Design","UseUtilityClass"
"4","","/Users/martinhoaragao/Dev/ProgrammerProfiler/ExerciseExamples/Ex3_A1_Arrays/Z/A1_Z.java","4","9","Use one line for each declaration, it enhances code readability.","Best Practices","OneDeclarationPerLine"
"5","","/Users/martinhoaragao/Dev/ProgrammerProfiler/ExerciseExamples/Ex3_A1_Arrays/Z/A1_Z.java","3","12","This statement should have braces","Code Style","ControlStatementBraces"
"6","","/Users/martinhoaragao/Dev/ProgrammerProfiler/ExerciseExamples/Ex3_A1_Arrays/Z/A1_Z.java","3","15","This statement should have braces","Code Style","ControlStatementBraces"
