"Problem","Package","File","Priority","Line","Description","Rule set","Rule"
"1","","/Users/martinhoaragao/Dev/ProgrammerProfiler/ExerciseExamples/Ex3_A1_Arrays/Aluno16/Exercicio3.java","3","5","All classes and interfaces must belong to a named package","Code Style","NoPackage"
"2","","/Users/martinhoaragao/Dev/ProgrammerProfiler/ExerciseExamples/Ex3_A1_Arrays/Aluno16/Exercicio3.java","3","5","All methods are static.  Consider using a utility class instead. Alternatively, you could add a private constructor or make the class abstract to silence this warning.","Design","UseUtilityClass"
"3","","/Users/martinhoaragao/Dev/ProgrammerProfiler/ExerciseExamples/Ex3_A1_Arrays/Aluno16/Exercicio3.java","1","5","The utility class name 'Exercicio3' doesn't match '[A-Z][a-zA-Z0-9]+(Utils?|Helper)'","Code Style","ClassNamingConventions"
"4","","/Users/martinhoaragao/Dev/ProgrammerProfiler/ExerciseExamples/Ex3_A1_Arrays/Aluno16/Exercicio3.java","3","22","This for loop can be replaced by a foreach loop","Best Practices","ForLoopCanBeForeach"
"5","","/Users/martinhoaragao/Dev/ProgrammerProfiler/ExerciseExamples/Ex3_A1_Arrays/Aluno16/Exercicio3.java","3","23","This statement should have braces","Code Style","ControlStatementBraces"
