"Problem","Package","File","Priority","Line","Description","Rule set","Rule"
"1","","/Users/martinhoaragao/Dev/ProgrammerProfiler/ExerciseExamples/Ex4_S1_Cadeia/Aluno58/Exercicio4.java","3","10","All classes and interfaces must belong to a named package","Code Style","NoPackage"
"2","","/Users/martinhoaragao/Dev/ProgrammerProfiler/ExerciseExamples/Ex4_S1_Cadeia/Aluno58/Exercicio4.java","1","10","The utility class name 'Exercicio4' doesn't match '[A-Z][a-zA-Z0-9]+(Utils?|Helper)'","Code Style","ClassNamingConventions"
"3","","/Users/martinhoaragao/Dev/ProgrammerProfiler/ExerciseExamples/Ex4_S1_Cadeia/Aluno58/Exercicio4.java","3","11","All methods are static.  Consider using a utility class instead. Alternatively, you could add a private constructor or make the class abstract to silence this warning.","Design","UseUtilityClass"
"4","","/Users/martinhoaragao/Dev/ProgrammerProfiler/ExerciseExamples/Ex4_S1_Cadeia/Aluno58/Exercicio4.java","3","13","Avoid unused local variables such as 'novo'.","Best Practices","UnusedLocalVariable"
"5","","/Users/martinhoaragao/Dev/ProgrammerProfiler/ExerciseExamples/Ex4_S1_Cadeia/Aluno58/Exercicio4.java","4","14","Use one line for each declaration, it enhances code readability.","Best Practices","OneDeclarationPerLine"
"6","","/Users/martinhoaragao/Dev/ProgrammerProfiler/ExerciseExamples/Ex4_S1_Cadeia/Aluno58/Exercicio4.java","3","15","Avoid unused local variables such as 'nv'.","Best Practices","UnusedLocalVariable"
