"Problem","Package","File","Priority","Line","Description","Rule set","Rule"
"1","","/Users/martinhoaragao/Dev/ProgrammerProfiler/ExerciseExamples/Ex1_P1_Numeros/Aluno49/Ex1.java","3","9","All classes and interfaces must belong to a named package","Code Style","NoPackage"
"2","","/Users/martinhoaragao/Dev/ProgrammerProfiler/ExerciseExamples/Ex1_P1_Numeros/Aluno49/Ex1.java","1","9","The utility class name 'Ex1' doesn't match '[A-Z][a-zA-Z0-9]+(Utils?|Helper)'","Code Style","ClassNamingConventions"
"3","","/Users/martinhoaragao/Dev/ProgrammerProfiler/ExerciseExamples/Ex1_P1_Numeros/Aluno49/Ex1.java","3","10","All methods are static.  Consider using a utility class instead. Alternatively, you could add a private constructor or make the class abstract to silence this warning.","Design","UseUtilityClass"
"4","","/Users/martinhoaragao/Dev/ProgrammerProfiler/ExerciseExamples/Ex1_P1_Numeros/Aluno49/Ex1.java","4","13","Use one line for each declaration, it enhances code readability.","Best Practices","OneDeclarationPerLine"
"5","","/Users/martinhoaragao/Dev/ProgrammerProfiler/ExerciseExamples/Ex1_P1_Numeros/Aluno49/Ex1.java","3","18","This statement should have braces","Code Style","ControlStatementBraces"
"6","","/Users/martinhoaragao/Dev/ProgrammerProfiler/ExerciseExamples/Ex1_P1_Numeros/Aluno49/Ex1.java","4","18","Useless parentheses.","Code Style","UselessParentheses"
"7","","/Users/martinhoaragao/Dev/ProgrammerProfiler/ExerciseExamples/Ex1_P1_Numeros/Aluno49/Ex1.java","3","19","This statement should have braces","Code Style","ControlStatementBraces"
