"Problem","Package","File","Priority","Line","Description","Rule set","Rule"
"1","","/Users/martinhoaragao/Dev/ProgrammerProfiler/ExerciseExamples/Ex4_S1_Cadeia/Aluno30/Exercicios.java","3","4","All classes and interfaces must belong to a named package","Code Style","NoPackage"
"2","","/Users/martinhoaragao/Dev/ProgrammerProfiler/ExerciseExamples/Ex4_S1_Cadeia/Aluno30/Exercicios.java","1","4","The utility class name 'Exercicios' doesn't match '[A-Z][a-zA-Z0-9]+(Utils?|Helper)'","Code Style","ClassNamingConventions"
"3","","/Users/martinhoaragao/Dev/ProgrammerProfiler/ExerciseExamples/Ex4_S1_Cadeia/Aluno30/Exercicios.java","3","5","All methods are static.  Consider using a utility class instead. Alternatively, you could add a private constructor or make the class abstract to silence this warning.","Design","UseUtilityClass"
"4","","/Users/martinhoaragao/Dev/ProgrammerProfiler/ExerciseExamples/Ex4_S1_Cadeia/Aluno30/Exercicios.java","1","7","The static method name 'exercicio_4' doesn't match '[a-z][a-zA-Z0-9]*'","Code Style","MethodNamingConventions"
"5","","/Users/martinhoaragao/Dev/ProgrammerProfiler/ExerciseExamples/Ex4_S1_Cadeia/Aluno30/Exercicios.java","1","9","The local variable name 'sub_cad' doesn't match '[a-z][a-zA-Z0-9]*'","Code Style","LocalVariableNamingConventions"
"6","","/Users/martinhoaragao/Dev/ProgrammerProfiler/ExerciseExamples/Ex4_S1_Cadeia/Aluno30/Exercicios.java","3","24","This statement should have braces","Code Style","ControlStatementBraces"
"7","","/Users/martinhoaragao/Dev/ProgrammerProfiler/ExerciseExamples/Ex4_S1_Cadeia/Aluno30/Exercicios.java","4","24","Useless parentheses.","Code Style","UselessParentheses"
"8","","/Users/martinhoaragao/Dev/ProgrammerProfiler/ExerciseExamples/Ex4_S1_Cadeia/Aluno30/Exercicios.java","3","27","This statement should have braces","Code Style","ControlStatementBraces"
