"Problem","Package","File","Priority","Line","Description","Rule set","Rule"
"1","","/Users/martinhoaragao/Dev/ProgrammerProfiler/ExerciseExamples/Ex4_S1_Cadeia/Aluno27/EX4.java","4","2","Avoid unused imports such as 'java.io'","Best Practices","UnusedImports"
"2","","/Users/martinhoaragao/Dev/ProgrammerProfiler/ExerciseExamples/Ex4_S1_Cadeia/Aluno27/EX4.java","3","4","All classes and interfaces must belong to a named package","Code Style","NoPackage"
"3","","/Users/martinhoaragao/Dev/ProgrammerProfiler/ExerciseExamples/Ex4_S1_Cadeia/Aluno27/EX4.java","1","4","The utility class name 'EX4' doesn't match '[A-Z][a-zA-Z0-9]+(Utils?|Helper)'","Code Style","ClassNamingConventions"
"4","","/Users/martinhoaragao/Dev/ProgrammerProfiler/ExerciseExamples/Ex4_S1_Cadeia/Aluno27/EX4.java","3","5","All methods are static.  Consider using a utility class instead. Alternatively, you could add a private constructor or make the class abstract to silence this warning.","Design","UseUtilityClass"
"5","","/Users/martinhoaragao/Dev/ProgrammerProfiler/ExerciseExamples/Ex4_S1_Cadeia/Aluno27/EX4.java","4","7","Use one line for each declaration, it enhances code readability.","Best Practices","OneDeclarationPerLine"
"6","","/Users/martinhoaragao/Dev/ProgrammerProfiler/ExerciseExamples/Ex4_S1_Cadeia/Aluno27/EX4.java","4","8","Use one line for each declaration, it enhances code readability.","Best Practices","OneDeclarationPerLine"
