"Problem","Package","File","Priority","Line","Description","Rule set","Rule"
"1","","/Users/martinhoaragao/Dev/ProgrammerProfiler/ExerciseExamples/Ex2_P2_Idades/Aluno30/Exercicios.java","3","4","All classes and interfaces must belong to a named package","Code Style","NoPackage"
"2","","/Users/martinhoaragao/Dev/ProgrammerProfiler/ExerciseExamples/Ex2_P2_Idades/Aluno30/Exercicios.java","1","4","The utility class name 'Exercicios' doesn't match '[A-Z][a-zA-Z0-9]+(Utils?|Helper)'","Code Style","ClassNamingConventions"
"3","","/Users/martinhoaragao/Dev/ProgrammerProfiler/ExerciseExamples/Ex2_P2_Idades/Aluno30/Exercicios.java","3","5","All methods are static.  Consider using a utility class instead. Alternatively, you could add a private constructor or make the class abstract to silence this warning.","Design","UseUtilityClass"
"4","","/Users/martinhoaragao/Dev/ProgrammerProfiler/ExerciseExamples/Ex2_P2_Idades/Aluno30/Exercicios.java","1","6","The static method name 'exercico_2' doesn't match '[a-z][a-zA-Z0-9]*'","Code Style","MethodNamingConventions"
"5","","/Users/martinhoaragao/Dev/ProgrammerProfiler/ExerciseExamples/Ex2_P2_Idades/Aluno30/Exercicios.java","1","14","The local variable name 'idade_aux' doesn't match '[a-z][a-zA-Z0-9]*'","Code Style","LocalVariableNamingConventions"
"6","","/Users/martinhoaragao/Dev/ProgrammerProfiler/ExerciseExamples/Ex2_P2_Idades/Aluno30/Exercicios.java","4","14","Use one line for each declaration, it enhances code readability.","Best Practices","OneDeclarationPerLine"
