"Problem","Package","File","Priority","Line","Description","Rule set","Rule"
"1","","/Users/martinhoaragao/Dev/ProgrammerProfiler/ExerciseExamples/Ex2_P2_Idades/Aluno21/ex2.java","4","5","All classes and interfaces must belong to a named package","Code Style","GenericsNaming"
"2","","/Users/martinhoaragao/Dev/ProgrammerProfiler/ExerciseExamples/Ex2_P2_Idades/Aluno21/ex2.java","1","5","The class name 'ex2' doesn't match '[A-Z][a-zA-Z0-9]*'","Code Style","ClassNamingConventions"
"3","","/Users/martinhoaragao/Dev/ProgrammerProfiler/ExerciseExamples/Ex2_P2_Idades/Aluno21/ex2.java","3","6","All methods are static.  Consider using a utility class instead. Alternatively, you could add a private constructor or make the class abstract to silence this warning.","Design","UseUtilityClass"
"4","","/Users/martinhoaragao/Dev/ProgrammerProfiler/ExerciseExamples/Ex2_P2_Idades/Aluno21/ex2.java","4","10","Use one line for each declaration, it enhances code readability.","Code Style","GenericsNaming"
"5","","/Users/martinhoaragao/Dev/ProgrammerProfiler/ExerciseExamples/Ex2_P2_Idades/Aluno21/ex2.java","4","11","Use one line for each declaration, it enhances code readability.","Code Style","GenericsNaming"
